{
  "contract": "specialist-report",
  "version": 3,
  "task_id": "requirements-brief-gpt",
  "build_revision": 0,
  "specialist": "ux",
  "trigger_reasons": [
    "AC2 governs the clarifying-question flow"
  ],
  "summary": "Flow step 1 allows unlimited clarifying questions, so users with vague ideas may never reach a brief.",
  "scope_review": {
    "reviewed_paths": [
      "instructions.md",
      "gpt-config.json",
      "behavior-contract.md",
      "evals/cases.md"
    ],
    "unavailable_context": [
      "Live transcripts"
    ]
  },
  "findings": [
    {
      "id": "S1",
      "severity": "MAJOR",
      "category": "ux",
      "file": "instructions.md",
      "lines": "Flow step 1",
      "quote": "1. Read the idea. Ask clarifying questions whenever anything is unclear, and keep asking until every detail is settled.",
      "trigger": "A user with a vague idea answers each question briefly.",
      "expected": "At most three questions, then a brief.",
      "actual": "Questions continue until every detail is settled.",
      "impact": "Conversation fatigue and abandonment before any brief is produced.",
      "fix": "Cap blocking questions at three and proceed with stated assumptions.",
      "evidence_basis": "static_proof",
      "evidence_detail": "The instruction has no upper bound or exit condition."
    }
  ],
  "non_findings": [
    "The five headings are plain-language and ordered from goal to action.",
    "The out-of-scope reply offers a useful next step (EV10)."
  ],
  "open_questions": [],
  "recommended_to_auditor": [
    "S1"
  ],
  "research_brief": null
}
